02:29:33.493321 IP (tos 0x0, ttl 64, id 886, offset 0, flags [DF], proto TCP (6), length 4496)
    ubuntu.ms-wbt-server > 198.19.255.145.34532: Flags [P.], cksum 0x2357 (incorrect -> 0xf098), seq 2615443667:2615448111, ack 3076358509, win 551, options [nop,nop,TS val 1467052296 ecr 1207788220], length 4444
02:29:33.493748 IP (tos 0x0, ttl 61, id 61650, offset 0, flags [DF], proto TCP (6), length 52)
    198.19.255.145.34532 > ubuntu.ms-wbt-server: Flags [.], cksum 0xe907 (correct), seq 1, ack 4444, win 3447, options [nop,nop,TS val 1207788274 ecr 1467052296], length 0
02:29:33.493755 IP (tos 0x0, ttl 64, id 890, offset 0, flags [DF], proto TCP (6), length 3953)
    ubuntu.ms-wbt-server > 198.19.255.145.34532: Flags [P.], cksum 0x2138 (incorrect -> 0x2c1f), seq 4444:8345, ack 1, win 551, options [nop,nop,TS val 1467052296 ecr 1207788220], length 3901
02:29:33.494083 IP (tos 0x0, ttl 61, id 61651, offset 0, flags [DF], proto TCP (6), length 52)
    198.19.255.145.34532 > ubuntu.ms-wbt-server: Flags [.], cksum 0xd9ca (correct), seq 1, ack 8345, win 3447, options [nop,nop,TS val 1207788274 ecr 1467052296], length 0
02:29:33.494222 IP (tos 0x0, ttl 64, id 893, offset 0, flags [DF], proto TCP (6), length 3242)
    ubuntu.ms-wbt-server > 198.19.255.145.34532: Flags [P.], cksum 0x1e71 (incorrect -> 0x5fcb), seq 8345:11535, ack 1, win 551, options [nop,nop,TS val 1467052297 ecr 1207788274], length 3190
02:29:33.494524 IP (tos 0x0, ttl 61, id 61652, offset 0, flags [DF], proto TCP (6), length 52)
    198.19.255.145.34532 > ubuntu.ms-wbt-server: Flags [.], cksum 0xce78 (correct), seq 1, ack 11241, win 3447, options [nop,nop,TS val 1207788275 ecr 1467052297], length 0
02:29:33.495292 IP (tos 0x0, ttl 64, id 896, offset 0, flags [DF], proto TCP (6), length 4580)
    ubuntu.ms-wbt-server > 198.19.255.145.34532: Flags [P.], cksum 0x23ab (incorrect -> 0x5ca7), seq 11535:16063, ack 1, win 551, options [nop,nop,TS val 1467052298 ecr 1207788275], length 4528
02:29:33.495674 IP (tos 0x0, ttl 61, id 61653, offset 0, flags [DF], proto TCP (6), length 52)
    198.19.255.145.34532 > ubuntu.ms-wbt-server: Flags [.], cksum 0xbc59 (correct), seq 1, ack 15879, win 3447, options [nop,nop,TS val 1207788276 ecr 1467052297], length 0
02:29:33.495683 IP (tos 0x0, ttl 64, id 900, offset 0, flags [DF], proto TCP (6), length 3802)
    ubuntu.ms-wbt-server > 198.19.255.145.34532: Flags [P.], cksum 0x20a1 (incorrect -> 0x7338), seq 16063:19813, ack 1, win 551, options [nop,nop,TS val 1467052298 ecr 1207788275], length 3750
02:29:33.496025 IP (tos 0x0, ttl 64, id 903, offset 0, flags [DF], proto TCP (6), length 3990)
    ubuntu.ms-wbt-server > 198.19.255.145.34532: Flags [P.], cksum 0x215d (incorrect -> 0x7f09), seq 19813:23751, ack 1, win 551, options [nop,nop,TS val 1467052299 ecr 1207788276], length 3938
02:29:33.496495 IP (tos 0x0, ttl 64, id 906, offset 0, flags [DF], proto TCP (6), length 3197)
    ubuntu.ms-wbt-server > 198.19.255.145.34532: Flags [P.], cksum 0x1e44 (incorrect -> 0xfcc1), seq 23751:26896, ack 1, win 551, options [nop,nop,TS val 1467052299 ecr 1207788276], length 3145
02:29:33.496858 IP (tos 0x0, ttl 64, id 909, offset 0, flags [DF], proto TCP (6), length 3298)
    ubuntu.ms-wbt-server > 198.19.255.145.34532: Flags [P.], cksum 0x1ea9 (incorrect -> 0xde7d), seq 26896:30142, ack 1, win 551, options [nop,nop,TS val 1467052299 ecr 1207788276], length 3246
02:29:33.496873 IP (tos 0x0, ttl 61, id 61654, offset 0, flags [DF], proto TCP (6), length 52)
    198.19.255.145.34532 > ubuntu.ms-wbt-server: Flags [.], cksum 0x919c (correct), seq 1, ack 26896, win 3369, options [nop,nop,TS val 1207788277 ecr 1467052298], length 0
02:29:33.497205 IP (tos 0x0, ttl 61, id 61655, offset 0, flags [DF], proto TCP (6), length 52)
    198.19.255.145.34532 > ubuntu.ms-wbt-server: Flags [.], cksum 0x8506 (correct), seq 1, ack 30142, win 3344, options [nop,nop,TS val 1207788277 ecr 1467052299], length 0
02:29:33.497459 IP (tos 0x0, ttl 64, id 912, offset 0, flags [DF], proto TCP (6), length 1841)
    ubuntu.ms-wbt-server > 198.19.255.145.34532: Flags [P.], cksum 0x18f8 (incorrect -> 0x4989), seq 30142:31931, ack 1, win 551, options [nop,nop,TS val 1467052300 ecr 1207788277], length 1789
02:29:33.497924 IP (tos 0x0, ttl 61, id 61656, offset 0, flags [DF], proto TCP (6), length 52)
    198.19.255.145.34532 > ubuntu.ms-wbt-server: Flags [.], cksum 0x7e14 (correct), seq 1, ack 31931, win 3331, options [nop,nop,TS val 1207788278 ecr 1467052300], length 0
02:29:33.500524 IP (tos 0x0, ttl 64, id 914, offset 0, flags [DF], proto TCP (6), length 4828)
    ubuntu.ms-wbt-server > 198.19.255.145.34532: Flags [P.], cksum 0x24a3 (incorrect -> 0xf12d), seq 31931:36707, ack 1, win 551, options [nop,nop,TS val 1467052303 ecr 1207788278], length 4776
02:29:33.500848 IP (tos 0x0, ttl 64, id 918, offset 0, flags [DF], proto TCP (6), length 3292)
    ubuntu.ms-wbt-server > 198.19.255.145.34532: Flags [P.], cksum 0x1ea3 (incorrect -> 0x805e), seq 36707:39947, ack 1, win 551, options [nop,nop,TS val 1467052303 ecr 1207788278], length 3240
02:29:33.500894 IP (tos 0x0, ttl 61, id 61657, offset 0, flags [DF], proto TCP (6), length 52)
    198.19.255.145.34532 > ubuntu.ms-wbt-server: Flags [.], cksum 0x6af2 (correct), seq 1, ack 36707, win 3447, options [nop,nop,TS val 1207788281 ecr 1467052303], length 0
02:29:33.501097 IP (tos 0x0, ttl 61, id 61658, offset 0, flags [DF], proto TCP (6), length 52)
    198.19.255.145.34532 > ubuntu.ms-wbt-server: Flags [.], cksum 0x5e4a (correct), seq 1, ack 39947, win 3447, options [nop,nop,TS val 1207788281 ecr 1467052303], length 0
02:29:33.501339 IP (tos 0x0, ttl 64, id 921, offset 0, flags [DF], proto TCP (6), length 3027)
    ubuntu.ms-wbt-server > 198.19.255.145.34532: Flags [P.], cksum 0x1d9a (incorrect -> 0x5637), seq 39947:42922, ack 1, win 551, options [nop,nop,TS val 1467052304 ecr 1207788281], length 2975
02:29:33.501643 IP (tos 0x0, ttl 61, id 61659, offset 0, flags [DF], proto TCP (6), length 52)
    198.19.255.145.34532 > ubuntu.ms-wbt-server: Flags [.], cksum 0x52a9 (correct), seq 1, ack 42922, win 3447, options [nop,nop,TS val 1207788282 ecr 1467052304], length 0
02:29:33.501690 IP (tos 0x0, ttl 64, id 924, offset 0, flags [DF], proto TCP (6), length 3263)
    ubuntu.ms-wbt-server > 198.19.255.145.34532: Flags [P.], cksum 0x1e86 (incorrect -> 0x5306), seq 42922:46133, ack 1, win 551, options [nop,nop,TS val 1467052304 ecr 1207788282], length 3211
02:29:33.501991 IP (tos 0x0, ttl 61, id 61660, offset 0, flags [DF], proto TCP (6), length 52)
    198.19.255.145.34532 > ubuntu.ms-wbt-server: Flags [.], cksum 0x461e (correct), seq 1, ack 46133, win 3447, options [nop,nop,TS val 1207788282 ecr 1467052304], length 0
02:29:33.502177 IP (tos 0x0, ttl 64, id 927, offset 0, flags [DF], proto TCP (6), length 2515)
    ubuntu.ms-wbt-server > 198.19.255.145.34532: Flags [P.], cksum 0x1b9a (incorrect -> 0x055e), seq 46133:48596, ack 1, win 551, options [nop,nop,TS val 1467052305 ecr 1207788282], length 2463
02:29:33.502489 IP (tos 0x0, ttl 61, id 61661, offset 0, flags [DF], proto TCP (6), length 52)
    198.19.255.145.34532 > ubuntu.ms-wbt-server: Flags [.], cksum 0x3c7d (correct), seq 1, ack 48596, win 3447, options [nop,nop,TS val 1207788283 ecr 1467052305], length 0
02:29:33.502679 IP (tos 0x0, ttl 64, id 929, offset 0, flags [DF], proto TCP (6), length 3009)
    ubuntu.ms-wbt-server > 198.19.255.145.34532: Flags [P.], cksum 0x1d88 (incorrect -> 0xd6ca), seq 48596:51553, ack 1, win 551, options [nop,nop,TS val 1467052305 ecr 1207788283], length 2957
02:29:33.502977 IP (tos 0x0, ttl 64, id 932, offset 0, flags [DF], proto TCP (6), length 3548)
    ubuntu.ms-wbt-server > 198.19.255.145.34532: Flags [P.], cksum 0x1fa3 (incorrect -> 0x60bb), seq 51553:55049, ack 1, win 551, options [nop,nop,TS val 1467052306 ecr 1207788283], length 3496
02:29:33.502977 IP (tos 0x0, ttl 61, id 61662, offset 0, flags [DF], proto TCP (6), length 52)
    198.19.255.145.34532 > ubuntu.ms-wbt-server: Flags [.], cksum 0x312d (correct), seq 1, ack 51492, win 3447, options [nop,nop,TS val 1207788283 ecr 1467052305], length 0
02:29:33.503221 IP (tos 0x0, ttl 61, id 61663, offset 0, flags [DF], proto TCP (6), length 52)
    198.19.255.145.34532 > ubuntu.ms-wbt-server: Flags [.], cksum 0x2348 (correct), seq 1, ack 55049, win 3447, options [nop,nop,TS val 1207788283 ecr 1467052305], length 0
02:29:33.503247 IP (tos 0x0, ttl 64, id 935, offset 0, flags [DF], proto TCP (6), length 3428)
    ubuntu.ms-wbt-server > 198.19.255.145.34532: Flags [P.], cksum 0x1f2b (incorrect -> 0x58e9), seq 55049:58425, ack 1, win 551, options [nop,nop,TS val 1467052306 ecr 1207788283], length 3376
02:29:33.503578 IP (tos 0x0, ttl 64, id 938, offset 0, flags [DF], proto TCP (6), length 3129)
    ubuntu.ms-wbt-server > 198.19.255.145.34532: Flags [P.], cksum 0x1e00 (incorrect -> 0x4975), seq 58425:61502, ack 1, win 551, options [nop,nop,TS val 1467052306 ecr 1207788283], length 3077
02:29:33.503596 IP (tos 0x0, ttl 61, id 61664, offset 0, flags [DF], proto TCP (6), length 52)
    198.19.255.145.34532 > ubuntu.ms-wbt-server: Flags [.], cksum 0x1616 (correct), seq 1, ack 58425, win 3447, options [nop,nop,TS val 1207788284 ecr 1467052306], length 0
02:29:33.503828 IP (tos 0x0, ttl 64, id 941, offset 0, flags [DF], proto TCP (6), length 3313)
    ubuntu.ms-wbt-server > 198.19.255.145.34532: Flags [P.], cksum 0x1eb8 (incorrect -> 0xbc09), seq 61502:64763, ack 1, win 551, options [nop,nop,TS val 1467052306 ecr 1207788284], length 3261
02:29:33.503930 IP (tos 0x0, ttl 61, id 61665, offset 0, flags [DF], proto TCP (6), length 52)
    198.19.255.145.34532 > ubuntu.ms-wbt-server: Flags [.], cksum 0x0a11 (correct), seq 1, ack 61502, win 3447, options [nop,nop,TS val 1207788284 ecr 1467052306], length 0
02:29:33.504053 IP (tos 0x0, ttl 61, id 61666, offset 0, flags [DF], proto TCP (6), length 52)
    198.19.255.145.34532 > ubuntu.ms-wbt-server: Flags [.], cksum 0xfd53 (correct), seq 1, ack 64763, win 3447, options [nop,nop,TS val 1207788284 ecr 1467052306], length 0
02:29:33.504219 IP (tos 0x0, ttl 64, id 944, offset 0, flags [DF], proto TCP (6), length 3200)
    ubuntu.ms-wbt-server > 198.19.255.145.34532: Flags [P.], cksum 0x1e47 (incorrect -> 0x23b9), seq 64763:67911, ack 1, win 551, options [nop,nop,TS val 1467052307 ecr 1207788284], length 3148
02:29:33.504537 IP (tos 0x0, ttl 61, id 61667, offset 0, flags [DF], proto TCP (6), length 52)
    198.19.255.145.34532 > ubuntu.ms-wbt-server: Flags [.], cksum 0xf105 (correct), seq 1, ack 67911, win 3447, options [nop,nop,TS val 1207788285 ecr 1467052307], length 0
02:29:33.504635 IP (tos 0x0, ttl 64, id 947, offset 0, flags [DF], proto TCP (6), length 3754)
    ubuntu.ms-wbt-server > 198.19.255.145.34532: Flags [P.], cksum 0x2071 (incorrect -> 0xd632), seq 67911:71613, ack 1, win 551, options [nop,nop,TS val 1467052307 ecr 1207788285], length 3702
02:29:33.504872 IP (tos 0x0, ttl 64, id 950, offset 0, flags [DF], proto TCP (6), length 3473)
    ubuntu.ms-wbt-server > 198.19.255.145.34532: Flags [P.], cksum 0x1f58 (incorrect -> 0xdff4), seq 71613:75034, ack 1, win 551, options [nop,nop,TS val 1467052307 ecr 1207788285], length 3421
02:29:33.505036 IP (tos 0x0, ttl 61, id 61668, offset 0, flags [DF], proto TCP (6), length 52)
    198.19.255.145.34532 > ubuntu.ms-wbt-server: Flags [.], cksum 0xe28f (correct), seq 1, ack 71613, win 3447, options [nop,nop,TS val 1207788285 ecr 1467052307], length 0
02:29:33.505130 IP (tos 0x0, ttl 64, id 953, offset 0, flags [DF], proto TCP (6), length 3270)
    ubuntu.ms-wbt-server > 198.19.255.145.34532: Flags [P.], cksum 0x1e8d (incorrect -> 0xf5e6), seq 75034:78252, ack 1, win 551, options [nop,nop,TS val 1467052308 ecr 1207788285], length 3218
02:29:33.505155 IP (tos 0x0, ttl 61, id 61669, offset 0, flags [DF], proto TCP (6), length 52)
    198.19.255.145.34532 > ubuntu.ms-wbt-server: Flags [.], cksum 0xd532 (correct), seq 1, ack 75034, win 3447, options [nop,nop,TS val 1207788285 ecr 1467052307], length 0
02:29:33.505429 IP (tos 0x0, ttl 61, id 61670, offset 0, flags [DF], proto TCP (6), length 52)
    198.19.255.145.34532 > ubuntu.ms-wbt-server: Flags [.], cksum 0xc89f (correct), seq 1, ack 78252, win 3447, options [nop,nop,TS val 1207788285 ecr 1467052308], length 0
02:29:33.505485 IP (tos 0x0, ttl 64, id 956, offset 0, flags [DF], proto TCP (6), length 3551)
    ubuntu.ms-wbt-server > 198.19.255.145.34532: Flags [P.], cksum 0x1fa6 (incorrect -> 0x06d3), seq 78252:81751, ack 1, win 551, options [nop,nop,TS val 1467052308 ecr 1207788285], length 3499
02:29:33.505814 IP (tos 0x0, ttl 61, id 61671, offset 0, flags [DF], proto TCP (6), length 52)
    198.19.255.145.34532 > ubuntu.ms-wbt-server: Flags [.], cksum 0xbd4e (correct), seq 1, ack 81148, win 3447, options [nop,nop,TS val 1207788286 ecr 1467052308], length 0
02:29:33.505883 IP (tos 0x0, ttl 64, id 959, offset 0, flags [DF], proto TCP (6), length 3234)
    ubuntu.ms-wbt-server > 198.19.255.145.34532: Flags [P.], cksum 0x1e69 (incorrect -> 0x9984), seq 81751:84933, ack 1, win 551, options [nop,nop,TS val 1467052308 ecr 1207788286], length 3182
02:29:33.506144 IP (tos 0x0, ttl 61, id 61672, offset 0, flags [DF], proto TCP (6), length 52)
    198.19.255.145.34532 > ubuntu.ms-wbt-server: Flags [.], cksum 0xae85 (correct), seq 1, ack 84933, win 3447, options [nop,nop,TS val 1207788286 ecr 1467052308], length 0
02:29:33.506394 IP (tos 0x0, ttl 64, id 962, offset 0, flags [DF], proto TCP (6), length 3694)
    ubuntu.ms-wbt-server > 198.19.255.145.34532: Flags [P.], cksum 0x2035 (incorrect -> 0x959e), seq 84933:88575, ack 1, win 551, options [nop,nop,TS val 1467052309 ecr 1207788286], length 3642
02:29:33.506646 IP (tos 0x0, ttl 64, id 965, offset 0, flags [DF], proto TCP (6), length 3213)
    ubuntu.ms-wbt-server > 198.19.255.145.34532: Flags [P.], cksum 0x1e54 (incorrect -> 0x93ef), seq 88575:91736, ack 1, win 551, options [nop,nop,TS val 1467052309 ecr 1207788286], length 3161
02:29:33.506683 IP (tos 0x0, ttl 61, id 61673, offset 0, flags [DF], proto TCP (6), length 52)
    198.19.255.145.34532 > ubuntu.ms-wbt-server: Flags [.], cksum 0xa333 (correct), seq 1, ack 87829, win 3447, options [nop,nop,TS val 1207788287 ecr 1467052309], length 0
02:29:33.506902 IP (tos 0x0, ttl 64, id 968, offset 0, flags [DF], proto TCP (6), length 3421)
    ubuntu.ms-wbt-server > 198.19.255.145.34532: Flags [P.], cksum 0x1f24 (incorrect -> 0x9498), seq 91736:95105, ack 1, win 551, options [nop,nop,TS val 1467052309 ecr 1207788287], length 3369
02:29:33.507014 IP (tos 0x0, ttl 61, id 61674, offset 0, flags [DF], proto TCP (6), length 52)
    198.19.255.145.34532 > ubuntu.ms-wbt-server: Flags [.], cksum 0x93f0 (correct), seq 1, ack 91736, win 3447, options [nop,nop,TS val 1207788287 ecr 1467052309], length 0
02:29:33.507248 IP (tos 0x0, ttl 64, id 971, offset 0, flags [DF], proto TCP (6), length 3763)
    ubuntu.ms-wbt-server > 198.19.255.145.34532: Flags [P.], cksum 0x207a (incorrect -> 0xa2d5), seq 95105:98816, ack 1, win 551, options [nop,nop,TS val 1467052310 ecr 1207788287], length 3711
02:29:33.507610 IP (tos 0x0, ttl 64, id 974, offset 0, flags [DF], proto TCP (6), length 3244)
    ubuntu.ms-wbt-server > 198.19.255.145.34532: Flags [P.], cksum 0x1e73 (incorrect -> 0x772c), seq 98816:102008, ack 1, win 551, options [nop,nop,TS val 1467052310 ecr 1207788287], length 3192
02:29:33.508087 IP (tos 0x0, ttl 64, id 977, offset 0, flags [DF], proto TCP (6), length 3604)
    ubuntu.ms-wbt-server > 198.19.255.145.34532: Flags [P.], cksum 0x1fdb (incorrect -> 0x30a6), seq 102008:105560, ack 1, win 551, options [nop,nop,TS val 1467052311 ecr 1207788287], length 3552
02:29:33.508300 IP (tos 0x0, ttl 64, id 980, offset 0, flags [DF], proto TCP (6), length 3104)
    ubuntu.ms-wbt-server > 198.19.255.145.34532: Flags [P.], cksum 0x1de7 (incorrect -> 0x1fc6), seq 105560:108612, ack 1, win 551, options [nop,nop,TS val 1467052311 ecr 1207788287], length 3052
02:29:33.508498 IP (tos 0x0, ttl 64, id 983, offset 0, flags [DF], proto TCP (6), length 2233)
    ubuntu.ms-wbt-server > 198.19.255.145.34532: Flags [P.], cksum 0x1a80 (incorrect -> 0x754d), seq 108612:110793, ack 1, win 551, options [nop,nop,TS val 1467052311 ecr 1207788287], length 2181
02:29:33.508867 IP (tos 0x0, ttl 64, id 985, offset 0, flags [DF], proto TCP (6), length 3629)
    ubuntu.ms-wbt-server > 198.19.255.145.34532: Flags [P.], cksum 0x1ff4 (incorrect -> 0x5744), seq 110793:114370, ack 1, win 551, options [nop,nop,TS val 1467052311 ecr 1207788287], length 3577
02:29:33.509928 IP (tos 0x0, ttl 64, id 988, offset 0, flags [DF], proto TCP (6), length 9550)
    ubuntu.ms-wbt-server > 198.19.255.145.34532: Flags [P.], cksum 0x3715 (incorrect -> 0xda1a), seq 114370:123868, ack 1, win 551, options [nop,nop,TS val 1467052312 ecr 1207788287], length 9498
02:29:33.517465 IP (tos 0x0, ttl 61, id 61675, offset 0, flags [DF], proto TCP (6), length 52)
    198.19.255.145.34532 > ubuntu.ms-wbt-server: Flags [.], cksum 0x174d (correct), seq 1, ack 123868, win 3212, options [nop,nop,TS val 1207788297 ecr 1467052309], length 0
02:29:33.517498 IP (tos 0x0, ttl 64, id 995, offset 0, flags [DF], proto TCP (6), length 3187)
    ubuntu.ms-wbt-server > 198.19.255.145.34532: Flags [P.], cksum 0x1e3a (incorrect -> 0x0e2e), seq 123868:127003, ack 1, win 551, options [nop,nop,TS val 1467052320 ecr 1207788297], length 3135
02:29:33.517602 IP (tos 0x0, ttl 64, id 998, offset 0, flags [DF], proto TCP (6), length 2943)
    ubuntu.ms-wbt-server > 198.19.255.145.34532: Flags [P.], cksum 0x1d46 (incorrect -> 0xb7b5), seq 127003:129894, ack 1, win 551, options [nop,nop,TS val 1467052320 ecr 1207788297], length 2891
02:29:33.517641 IP (tos 0x0, ttl 64, id 1000, offset 0, flags [DF], proto TCP (6), length 6227)
    ubuntu.ms-wbt-server > 198.19.255.145.34532: Flags [P.], cksum 0x2a1a (incorrect -> 0xb9f3), seq 129894:136069, ack 1, win 551, options [nop,nop,TS val 1467052320 ecr 1207788297], length 6175
02:29:33.517673 IP (tos 0x0, ttl 64, id 1005, offset 0, flags [DF], proto TCP (6), length 4313)
    ubuntu.ms-wbt-server > 198.19.255.145.34532: Flags [P.], cksum 0x22a0 (incorrect -> 0x9a62), seq 136069:140330, ack 1, win 551, options [nop,nop,TS val 1467052320 ecr 1207788297], length 4261
02:29:33.517705 IP (tos 0x0, ttl 64, id 1008, offset 0, flags [DF], proto TCP (6), length 6666)
    ubuntu.ms-wbt-server > 198.19.255.145.34532: Flags [P.], cksum 0x2bd1 (incorrect -> 0xe614), seq 140330:146944, ack 1, win 551, options [nop,nop,TS val 1467052320 ecr 1207788297], length 6614
02:29:33.517791 IP (tos 0x0, ttl 64, id 1013, offset 0, flags [DF], proto TCP (6), length 9822)
    ubuntu.ms-wbt-server > 198.19.255.145.34532: Flags [P.], cksum 0x3825 (incorrect -> 0x482d), seq 146944:156714, ack 1, win 551, options [nop,nop,TS val 1467052320 ecr 1207788297], length 9770
02:29:33.517913 IP (tos 0x0, ttl 64, id 1020, offset 0, flags [DF], proto TCP (6), length 4445)
    ubuntu.ms-wbt-server > 198.19.255.145.34532: Flags [P.], cksum 0x2324 (incorrect -> 0x1d4e), seq 156714:161107, ack 1, win 551, options [nop,nop,TS val 1467052320 ecr 1207788297], length 4393
02:29:33.518005 IP (tos 0x0, ttl 61, id 61676, offset 0, flags [DF], proto TCP (6), length 52)
    198.19.255.145.34532 > ubuntu.ms-wbt-server: Flags [.], cksum 0xe7d6 (correct), seq 1, ack 136069, win 3149, options [nop,nop,TS val 1207788298 ecr 1467052320], length 0
02:29:33.518053 IP (tos 0x0, ttl 64, id 1024, offset 0, flags [DF], proto TCP (6), length 3205)
    ubuntu.ms-wbt-server > 198.19.255.145.34532: Flags [P.], cksum 0x1e4c (incorrect -> 0xc6a8), seq 161107:164260, ack 1, win 551, options [nop,nop,TS val 1467052321 ecr 1207788298], length 3153
02:29:33.518131 IP (tos 0x0, ttl 61, id 61677, offset 0, flags [DF], proto TCP (6), length 52)
    198.19.255.145.34532 > ubuntu.ms-wbt-server: Flags [.], cksum 0xcc08 (correct), seq 1, ack 143226, win 3110, options [nop,nop,TS val 1207788298 ecr 1467052320], length 0
02:29:33.518142 IP (tos 0x0, ttl 64, id 1027, offset 0, flags [DF], proto TCP (6), length 3165)
    ubuntu.ms-wbt-server > 198.19.255.145.34532: Flags [P.], cksum 0x1e24 (incorrect -> 0x20d9), seq 164260:167373, ack 1, win 551, options [nop,nop,TS val 1467052321 ecr 1207788298], length 3113
02:29:33.518428 IP (tos 0x0, ttl 61, id 61678, offset 0, flags [DF], proto TCP (6), length 52)
    198.19.255.145.34532 > ubuntu.ms-wbt-server: Flags [.], cksum 0x7b3f (correct), seq 1, ack 164003, win 3014, options [nop,nop,TS val 1207788298 ecr 1467052320], length 0
02:29:33.518681 IP (tos 0x0, ttl 61, id 61679, offset 0, flags [DF], proto TCP (6), length 52)
    198.19.255.145.34532 > ubuntu.ms-wbt-server: Flags [.], cksum 0x6e2d (correct), seq 1, ack 167373, win 2988, options [nop,nop,TS val 1207788299 ecr 1467052321], length 0
02:29:33.523159 IP (tos 0x0, ttl 61, id 61680, offset 0, flags [DF], proto TCP (6), length 65)
    198.19.255.145.34532 > ubuntu.ms-wbt-server: Flags [P.], cksum 0xd675 (correct), seq 1:14, ack 167373, win 3447, options [nop,nop,TS val 1207788303 ecr 1467052321], length 13
02:29:33.523247 IP (tos 0x0, ttl 64, id 1030, offset 0, flags [DF], proto TCP (6), length 52)
    ubuntu.ms-wbt-server > 198.19.255.145.34532: Flags [.], cksum 0x11fb (incorrect -> 0x779c), seq 167373, ack 14, win 551, options [nop,nop,TS val 1467052326 ecr 1207788303], length 0
02:29:33.542745 IP (tos 0x0, ttl 64, id 1031, offset 0, flags [DF], proto TCP (6), length 3238)
    ubuntu.ms-wbt-server > 198.19.255.145.34532: Flags [P.], cksum 0x1e6d (incorrect -> 0xcdaf), seq 167373:170559, ack 14, win 551, options [nop,nop,TS val 1467052345 ecr 1207788303], length 3186
02:29:33.543110 IP (tos 0x0, ttl 61, id 61681, offset 0, flags [DF], proto TCP (6), length 52)
    198.19.255.145.34532 > ubuntu.ms-wbt-server: Flags [.], cksum 0x5fb3 (correct), seq 14, ack 170559, win 3447, options [nop,nop,TS val 1207788323 ecr 1467052345], length 0
02:29:33.543114 IP (tos 0x0, ttl 64, id 1034, offset 0, flags [DF], proto TCP (6), length 3785)
    ubuntu.ms-wbt-server > 198.19.255.145.34532: Flags [P.], cksum 0x2090 (incorrect -> 0xeff7), seq 170559:174292, ack 14, win 551, options [nop,nop,TS val 1467052346 ecr 1207788303], length 3733
02:29:33.543355 IP (tos 0x0, ttl 64, id 1037, offset 0, flags [DF], proto TCP (6), length 4390)
    ubuntu.ms-wbt-server > 198.19.255.145.34532: Flags [P.], cksum 0x22ed (incorrect -> 0x438c), seq 174292:178630, ack 14, win 551, options [nop,nop,TS val 1467052346 ecr 1207788323], length 4338
02:29:33.543475 IP (tos 0x0, ttl 61, id 61682, offset 0, flags [DF], proto TCP (6), length 52)
    198.19.255.145.34532 > ubuntu.ms-wbt-server: Flags [.], cksum 0x5461 (correct), seq 14, ack 173455, win 3447, options [nop,nop,TS val 1207788324 ecr 1467052346], length 0
02:29:33.543650 IP (tos 0x0, ttl 61, id 61683, offset 0, flags [DF], proto TCP (6), length 52)
    198.19.255.145.34532 > ubuntu.ms-wbt-server: Flags [.], cksum 0x402a (correct), seq 14, ack 178630, win 3447, options [nop,nop,TS val 1207788324 ecr 1467052346], length 0
02:29:33.543767 IP (tos 0x0, ttl 64, id 1040, offset 0, flags [DF], proto TCP (6), length 4009)
    ubuntu.ms-wbt-server > 198.19.255.145.34532: Flags [P.], cksum 0x2170 (incorrect -> 0x7cb3), seq 178630:182587, ack 14, win 551, options [nop,nop,TS val 1467052346 ecr 1207788324], length 3957
02:29:33.544206 IP (tos 0x0, ttl 61, id 61684, offset 0, flags [DF], proto TCP (6), length 52)
    198.19.255.145.34532 > ubuntu.ms-wbt-server: Flags [.], cksum 0x30c5 (correct), seq 14, ack 182587, win 3431, options [nop,nop,TS val 1207788324 ecr 1467052346], length 0
02:29:33.544309 IP (tos 0x0, ttl 64, id 1043, offset 0, flags [DF], proto TCP (6), length 2967)
    ubuntu.ms-wbt-server > 198.19.255.145.34532: Flags [P.], cksum 0x1d5e (incorrect -> 0x4bb4), seq 182587:185502, ack 14, win 551, options [nop,nop,TS val 1467052347 ecr 1207788324], length 2915
02:29:33.544591 IP (tos 0x0, ttl 61, id 61685, offset 0, flags [DF], proto TCP (6), length 52)
    198.19.255.145.34532 > ubuntu.ms-wbt-server: Flags [.], cksum 0x2576 (correct), seq 14, ack 185502, win 3409, options [nop,nop,TS val 1207788325 ecr 1467052347], length 0
02:29:33.545056 IP (tos 0x0, ttl 64, id 1046, offset 0, flags [DF], proto TCP (6), length 2954)
    ubuntu.ms-wbt-server > 198.19.255.145.34532: Flags [P.], cksum 0x1d51 (incorrect -> 0x1248), seq 185502:188404, ack 14, win 551, options [nop,nop,TS val 1467052348 ecr 1207788325], length 2902
02:29:33.545387 IP (tos 0x0, ttl 61, id 61686, offset 0, flags [DF], proto TCP (6), length 52)
    198.19.255.145.34532 > ubuntu.ms-wbt-server: Flags [.], cksum 0x19f9 (correct), seq 14, ack 188404, win 3447, options [nop,nop,TS val 1207788325 ecr 1467052348], length 0
02:29:33.545397 IP (tos 0x0, ttl 64, id 1049, offset 0, flags [DF], proto TCP (6), length 3584)
    ubuntu.ms-wbt-server > 198.19.255.145.34532: Flags [P.], cksum 0x1fc7 (incorrect -> 0x498a), seq 188404:191936, ack 14, win 551, options [nop,nop,TS val 1467052348 ecr 1207788325], length 3532
02:29:33.545623 IP (tos 0x0, ttl 64, id 1052, offset 0, flags [DF], proto TCP (6), length 3876)
    ubuntu.ms-wbt-server > 198.19.255.145.34532: Flags [P.], cksum 0x20eb (incorrect -> 0x5899), seq 191936:195760, ack 14, win 551, options [nop,nop,TS val 1467052348 ecr 1207788325], length 3824
02:29:33.545638 IP (tos 0x0, ttl 61, id 61687, offset 0, flags [DF], proto TCP (6), length 52)
    198.19.255.145.34532 > ubuntu.ms-wbt-server: Flags [.], cksum 0x0c2c (correct), seq 14, ack 191936, win 3447, options [nop,nop,TS val 1207788326 ecr 1467052348], length 0
02:29:33.545972 IP (tos 0x0, ttl 61, id 61688, offset 0, flags [DF], proto TCP (6), length 52)
    198.19.255.145.34532 > ubuntu.ms-wbt-server: Flags [.], cksum 0x00e4 (correct), seq 14, ack 194832, win 3439, options [nop,nop,TS val 1207788326 ecr 1467052348], length 0
02:29:33.546059 IP (tos 0x0, ttl 64, id 1055, offset 0, flags [DF], proto TCP (6), length 2978)
    ubuntu.ms-wbt-server > 198.19.255.145.34532: Flags [P.], cksum 0x1d69 (incorrect -> 0xcb37), seq 195760:198686, ack 14, win 551, options [nop,nop,TS val 1467052349 ecr 1207788326], length 2926
02:29:33.546325 IP (tos 0x0, ttl 64, id 1058, offset 0, flags [DF], proto TCP (6), length 3975)
    ubuntu.ms-wbt-server > 198.19.255.145.34532: Flags [P.], cksum 0x214e (incorrect -> 0xf936), seq 198686:202609, ack 14, win 551, options [nop,nop,TS val 1467052349 ecr 1207788326], length 3923
02:29:33.546389 IP (tos 0x0, ttl 61, id 61689, offset 0, flags [DF], proto TCP (6), length 52)
    198.19.255.145.34532 > ubuntu.ms-wbt-server: Flags [.], cksum 0xf1cd (correct), seq 14, ack 198686, win 3447, options [nop,nop,TS val 1207788326 ecr 1467052348], length 0
02:29:33.546690 IP (tos 0x0, ttl 61, id 61690, offset 0, flags [DF], proto TCP (6), length 52)
    198.19.255.145.34532 > ubuntu.ms-wbt-server: Flags [.], cksum 0xe278 (correct), seq 14, ack 202609, win 3447, options [nop,nop,TS val 1207788327 ecr 1467052349], length 0
02:29:33.546737 IP (tos 0x0, ttl 64, id 1061, offset 0, flags [DF], proto TCP (6), length 3225)
    ubuntu.ms-wbt-server > 198.19.255.145.34532: Flags [P.], cksum 0x1e60 (incorrect -> 0xcfbc), seq 202609:205782, ack 14, win 551, options [nop,nop,TS val 1467052349 ecr 1207788327], length 3173
02:29:33.547079 IP (tos 0x0, ttl 61, id 61691, offset 0, flags [DF], proto TCP (6), length 52)
    198.19.255.145.34532 > ubuntu.ms-wbt-server: Flags [.], cksum 0xd728 (correct), seq 14, ack 205505, win 3447, options [nop,nop,TS val 1207788327 ecr 1467052349], length 0
02:29:33.547115 IP (tos 0x0, ttl 64, id 1064, offset 0, flags [DF], proto TCP (6), length 3952)
    ubuntu.ms-wbt-server > 198.19.255.145.34532: Flags [P.], cksum 0x2137 (incorrect -> 0xbd12), seq 205782:209682, ack 14, win 551, options [nop,nop,TS val 1467052350 ecr 1207788327], length 3900
02:29:33.547300 IP (tos 0x0, ttl 64, id 1067, offset 0, flags [DF], proto TCP (6), length 3031)
    ubuntu.ms-wbt-server > 198.19.255.145.34532: Flags [P.], cksum 0x1d9e (incorrect -> 0xff3e), seq 209682:212661, ack 14, win 551, options [nop,nop,TS val 1467052350 ecr 1207788327], length 2979
02:29:33.547491 IP (tos 0x0, ttl 61, id 61692, offset 0, flags [DF], proto TCP (6), length 52)
    198.19.255.145.34532 > ubuntu.ms-wbt-server: Flags [.], cksum 0xc6d6 (correct), seq 14, ack 209682, win 3447, options [nop,nop,TS val 1207788328 ecr 1467052349], length 0
02:29:33.547597 IP (tos 0x0, ttl 64, id 1070, offset 0, flags [DF], proto TCP (6), length 2897)
    ubuntu.ms-wbt-server > 198.19.255.145.34532: Flags [P.], cksum 0x1d18 (incorrect -> 0x3f30), seq 212661:215506, ack 14, win 551, options [nop,nop,TS val 1467052350 ecr 1207788328], length 2845
02:29:33.547691 IP (tos 0x0, ttl 61, id 61693, offset 0, flags [DF], proto TCP (6), length 52)
    198.19.255.145.34532 > ubuntu.ms-wbt-server: Flags [.], cksum 0xbb32 (correct), seq 14, ack 212661, win 3447, options [nop,nop,TS val 1207788328 ecr 1467052350], length 0
02:29:33.547786 IP (tos 0x0, ttl 64, id 1072, offset 0, flags [DF], proto TCP (6), length 729)
    ubuntu.ms-wbt-server > 198.19.255.145.34532: Flags [P.], cksum 0x14a0 (incorrect -> 0x0fc6), seq 215506:216183, ack 14, win 551, options [nop,nop,TS val 1467052350 ecr 1207788328], length 677
02:29:33.547888 IP (tos 0x0, ttl 61, id 61694, offset 0, flags [DF], proto TCP (6), length 52)
    198.19.255.145.34532 > ubuntu.ms-wbt-server: Flags [.], cksum 0xb015 (correct), seq 14, ack 215506, win 3447, options [nop,nop,TS val 1207788328 ecr 1467052350], length 0
02:29:33.548141 IP (tos 0x0, ttl 64, id 1073, offset 0, flags [DF], proto TCP (6), length 3826)
    ubuntu.ms-wbt-server > 198.19.255.145.34532: Flags [P.], cksum 0x20b9 (incorrect -> 0x9e78), seq 216183:219957, ack 14, win 551, options [nop,nop,TS val 1467052351 ecr 1207788328], length 3774
02:29:33.548457 IP (tos 0x0, ttl 61, id 61695, offset 0, flags [DF], proto TCP (6), length 52)
    198.19.255.145.34532 > ubuntu.ms-wbt-server: Flags [.], cksum 0x9eb1 (correct), seq 14, ack 219957, win 3447, options [nop,nop,TS val 1207788329 ecr 1467052350], length 0
02:29:33.548521 IP (tos 0x0, ttl 64, id 1076, offset 0, flags [DF], proto TCP (6), length 3877)
    ubuntu.ms-wbt-server > 198.19.255.145.34532: Flags [P.], cksum 0x20ec (incorrect -> 0xc886), seq 219957:223782, ack 14, win 551, options [nop,nop,TS val 1467052351 ecr 1207788329], length 3825
02:29:33.548735 IP (tos 0x0, ttl 64, id 1079, offset 0, flags [DF], proto TCP (6), length 3148)
    ubuntu.ms-wbt-server > 198.19.255.145.34532: Flags [P.], cksum 0x1e13 (incorrect -> 0x0d0b), seq 223782:226878, ack 14, win 551, options [nop,nop,TS val 1467052351 ecr 1207788329], length 3096
02:29:33.548884 IP (tos 0x0, ttl 61, id 61696, offset 0, flags [DF], proto TCP (6), length 52)
    198.19.255.145.34532 > ubuntu.ms-wbt-server: Flags [.], cksum 0x9360 (correct), seq 14, ack 222853, win 3447, options [nop,nop,TS val 1207788329 ecr 1467052351], length 0
02:29:33.548944 IP (tos 0x0, ttl 64, id 1082, offset 0, flags [DF], proto TCP (6), length 3307)
    ubuntu.ms-wbt-server > 198.19.255.145.34532: Flags [P.], cksum 0x1eb2 (incorrect -> 0x1c43), seq 226878:230133, ack 14, win 551, options [nop,nop,TS val 1467052352 ecr 1207788329], length 3255
02:29:33.549082 IP (tos 0x0, ttl 61, id 61697, offset 0, flags [DF], proto TCP (6), length 52)
    198.19.255.145.34532 > ubuntu.ms-wbt-server: Flags [.], cksum 0x83a7 (correct), seq 14, ack 226878, win 3447, options [nop,nop,TS val 1207788329 ecr 1467052351], length 0
02:29:33.549241 IP (tos 0x0, ttl 64, id 1085, offset 0, flags [DF], proto TCP (6), length 2904)
    ubuntu.ms-wbt-server > 198.19.255.145.34532: Flags [P.], cksum 0x1d1f (incorrect -> 0x0a66), seq 230133:232985, ack 14, win 551, options [nop,nop,TS val 1467052352 ecr 1207788329], length 2852
02:29:33.549325 IP (tos 0x0, ttl 61, id 61698, offset 0, flags [DF], proto TCP (6), length 52)
    198.19.255.145.34532 > ubuntu.ms-wbt-server: Flags [.], cksum 0x76f7 (correct), seq 14, ack 230133, win 3439, options [nop,nop,TS val 1207788329 ecr 1467052352], length 0
02:29:33.549471 IP (tos 0x0, ttl 64, id 1087, offset 0, flags [DF], proto TCP (6), length 2852)
    ubuntu.ms-wbt-server > 198.19.255.145.34532: Flags [P.], cksum 0x1ceb (incorrect -> 0x0ebb), seq 232985:235785, ack 14, win 551, options [nop,nop,TS val 1467052352 ecr 1207788329], length 2800
02:29:33.549527 IP (tos 0x0, ttl 61, id 61699, offset 0, flags [DF], proto TCP (6), length 52)
    198.19.255.145.34532 > ubuntu.ms-wbt-server: Flags [.], cksum 0x6bca (correct), seq 14, ack 232985, win 3447, options [nop,nop,TS val 1207788330 ecr 1467052352], length 0
02:29:33.549811 IP (tos 0x0, ttl 61, id 61700, offset 0, flags [DF], proto TCP (6), length 52)
    198.19.255.145.34532 > ubuntu.ms-wbt-server: Flags [.], cksum 0x60da (correct), seq 14, ack 235785, win 3447, options [nop,nop,TS val 1207788330 ecr 1467052352], length 0
02:29:33.549883 IP (tos 0x0, ttl 64, id 1089, offset 0, flags [DF], proto TCP (6), length 4195)
    ubuntu.ms-wbt-server > 198.19.255.145.34532: Flags [P.], cksum 0x222a (incorrect -> 0x6322), seq 235785:239928, ack 14, win 551, options [nop,nop,TS val 1467052352 ecr 1207788330], length 4143
02:29:33.550179 IP (tos 0x0, ttl 61, id 61701, offset 0, flags [DF], proto TCP (6), length 52)
    198.19.255.145.34532 > ubuntu.ms-wbt-server: Flags [.], cksum 0x558a (correct), seq 14, ack 238681, win 3447, options [nop,nop,TS val 1207788330 ecr 1467052352], length 0
02:29:33.550297 IP (tos 0x0, ttl 64, id 1092, offset 0, flags [DF], proto TCP (6), length 4437)
    ubuntu.ms-wbt-server > 198.19.255.145.34532: Flags [P.], cksum 0x231c (incorrect -> 0x398c), seq 239928:244313, ack 14, win 551, options [nop,nop,TS val 1467052353 ecr 1207788330], length 4385
02:29:33.550504 IP (tos 0x0, ttl 64, id 1096, offset 0, flags [DF], proto TCP (6), length 3200)
    ubuntu.ms-wbt-server > 198.19.255.145.34532: Flags [P.], cksum 0x1e47 (incorrect -> 0x812b), seq 244313:247461, ack 14, win 551, options [nop,nop,TS val 1467052353 ecr 1207788330], length 3148
02:29:33.550673 IP (tos 0x0, ttl 61, id 61702, offset 0, flags [DF], proto TCP (6), length 52)
    198.19.255.145.34532 > ubuntu.ms-wbt-server: Flags [.], cksum 0x3f89 (correct), seq 14, ack 244313, win 3447, options [nop,nop,TS val 1207788331 ecr 1467052352], length 0
02:29:33.550730 IP (tos 0x0, ttl 64, id 1099, offset 0, flags [DF], proto TCP (6), length 3071)
    ubuntu.ms-wbt-server > 198.19.255.145.34532: Flags [P.], cksum 0x1dc6 (incorrect -> 0xc5cf), seq 247461:250480, ack 14, win 551, options [nop,nop,TS val 1467052353 ecr 1207788331], length 3019
02:29:33.550875 IP (tos 0x0, ttl 61, id 61703, offset 0, flags [DF], proto TCP (6), length 52)
    198.19.255.145.34532 > ubuntu.ms-wbt-server: Flags [.], cksum 0x3438 (correct), seq 14, ack 247209, win 3447, options [nop,nop,TS val 1207788331 ecr 1467052353], length 0
02:29:33.551002 IP (tos 0x0, ttl 61, id 61704, offset 0, flags [DF], proto TCP (6), length 52)
    198.19.255.145.34532 > ubuntu.ms-wbt-server: Flags [.], cksum 0x2771 (correct), seq 14, ack 250480, win 3447, options [nop,nop,TS val 1207788331 ecr 1467052353], length 0
02:29:33.551030 IP (tos 0x0, ttl 64, id 1102, offset 0, flags [DF], proto TCP (6), length 3026)
    ubuntu.ms-wbt-server > 198.19.255.145.34532: Flags [P.], cksum 0x1d99 (incorrect -> 0xf2f0), seq 250480:253454, ack 14, win 551, options [nop,nop,TS val 1467052354 ecr 1207788331], length 2974
02:29:33.551234 ARP, Ethernet (len 6), IPv4 (len 4), Request who-has ubuntu (00:50:56:97:a0:33 (oui Unknown)) tell ntp.demo.dcloud.cisco.com, length 46
02:29:33.551246 ARP, Ethernet (len 6), IPv4 (len 4), Reply ubuntu is-at 00:50:56:97:a0:33 (oui Unknown), length 28
02:29:33.551341 IP (tos 0x0, ttl 64, id 1105, offset 0, flags [DF], proto TCP (6), length 2116)
    ubuntu.ms-wbt-server > 198.19.255.145.34532: Flags [P.], cksum 0x1a0b (incorrect -> 0x8773), seq 253454:255518, ack 14, win 551, options [nop,nop,TS val 1467052354 ecr 1207788331], length 2064
02:29:33.551343 IP (tos 0x0, ttl 61, id 61705, offset 0, flags [DF], proto TCP (6), length 52)
    198.19.255.145.34532 > ubuntu.ms-wbt-server: Flags [.], cksum 0x1bd2 (correct), seq 14, ack 253454, win 3447, options [nop,nop,TS val 1207788331 ecr 1467052354], length 0
02:29:33.551484 IP (tos 0x0, ttl 64, id 15590, offset 0, flags [none], proto UDP (17), length 84)
    ubuntu.42376 > 198.18.133.1.domain: [bad udp cksum 0x9794 -> 0x420d!] 6439+ [1au] PTR? 145.255.19.198.in-addr.arpa. ar: . OPT UDPsize=1472 (56)
02:29:33.551664 IP (tos 0x0, ttl 61, id 61706, offset 0, flags [DF], proto TCP (6), length 52)
    198.19.255.145.34532 > ubuntu.ms-wbt-server: Flags [.], cksum 0x13c1 (correct), seq 14, ack 255518, win 3447, options [nop,nop,TS val 1207788332 ecr 1467052354], length 0
02:29:33.551847 IP (tos 0x0, ttl 64, id 1107, offset 0, flags [DF], proto TCP (6), length 4594)
    ubuntu.ms-wbt-server > 198.19.255.145.34532: Flags [P.], cksum 0x23b9 (incorrect -> 0xf65e), seq 255518:260060, ack 14, win 551, options [nop,nop,TS val 1467052354 ecr 1207788332], length 4542
02:29:33.552099 IP (tos 0x0, ttl 64, id 1111, offset 0, flags [DF], proto TCP (6), length 3751)
    ubuntu.ms-wbt-server > 198.19.255.145.34532: Flags [P.], cksum 0x206e (incorrect -> 0x4a85), seq 260060:263759, ack 14, win 551, options [nop,nop,TS val 1467052355 ecr 1207788332], length 3699
02:29:33.552156 IP (tos 0x0, ttl 61, id 61707, offset 0, flags [DF], proto TCP (6), length 52)
    198.19.255.145.34532 > ubuntu.ms-wbt-server: Flags [.], cksum 0x0203 (correct), seq 14, ack 260060, win 3447, options [nop,nop,TS val 1207788332 ecr 1467052354], length 0
02:29:33.552316 IP (tos 0x0, ttl 64, id 1114, offset 0, flags [DF], proto TCP (6), length 3125)
    ubuntu.ms-wbt-server > 198.19.255.145.34532: Flags [P.], cksum 0x1dfc (incorrect -> 0x16be), seq 263759:266832, ack 14, win 551, options [nop,nop,TS val 1467052355 ecr 1207788332], length 3073
02:29:33.552350 IP (tos 0x0, ttl 64, id 61989, offset 0, flags [none], proto UDP (17), length 154)
    198.18.133.1.domain > ubuntu.42376: [udp sum ok] 6439 NXDomain q: PTR? 145.255.19.198.in-addr.arpa. 0/1/1 ns: 198.in-addr.arpa. SOA z.arin.net. dns-ops.arin.net. 2017036437 1800 900 691200 10800 ar: . OPT UDPsize=1232 (126)
02:29:33.552446 IP (tos 0x0, ttl 64, id 15591, offset 0, flags [none], proto UDP (17), length 73)
    ubuntu.42376 > 198.18.133.1.domain: [bad udp cksum 0x9789 -> 0x480d!] 6439+ PTR? 145.255.19.198.in-addr.arpa. (45)
02:29:33.552462 IP (tos 0x0, ttl 61, id 61708, offset 0, flags [DF], proto TCP (6), length 52)
    198.19.255.145.34532 > ubuntu.ms-wbt-server: Flags [.], cksum 0xf38d (correct), seq 14, ack 263759, win 3447, options [nop,nop,TS val 1207788333 ecr 1467052355], length 0
02:29:33.552617 IP (tos 0x0, ttl 64, id 1117, offset 0, flags [DF], proto TCP (6), length 3222)
    ubuntu.ms-wbt-server > 198.19.255.145.34532: Flags [P.], cksum 0x1e5d (incorrect -> 0x5b19), seq 266832:270002, ack 14, win 551, options [nop,nop,TS val 1467052355 ecr 1207788333], length 3170
02:29:33.552633 IP (tos 0x0, ttl 61, id 61709, offset 0, flags [DF], proto TCP (6), length 52)
    198.19.255.145.34532 > ubuntu.ms-wbt-server: Flags [.], cksum 0xe78c (correct), seq 14, ack 266832, win 3447, options [nop,nop,TS val 1207788333 ecr 1467052355], length 0
02:29:33.552833 IP (tos 0x0, ttl 64, id 61990, offset 0, flags [none], proto UDP (17), length 143)
    198.18.133.1.domain > ubuntu.42376: [udp sum ok] 6439 NXDomain q: PTR? 145.255.19.198.in-addr.arpa. 0/1/0 ns: 198.in-addr.arpa. SOA z.arin.net. dns-ops.arin.net. 2017036437 1800 900 691200 10800 (115)
02:29:33.552944 IP (tos 0x0, ttl 64, id 1120, offset 0, flags [DF], proto TCP (6), length 3235)
    ubuntu.ms-wbt-server > 198.19.255.145.34532: Flags [P.], cksum 0x1e6a (incorrect -> 0x08d9), seq 270002:273185, ack 14, win 551, options [nop,nop,TS val 1467052356 ecr 1207788333], length 3183
